{
  "schema_version": "xuunity.fitness-fixture.v1",
  "fixture_id": "f2_override_precedence",
  "revision": "2026-07-30.1",
  "family": "F2",
  "seed": {
    "content_hash": "3f92348ee4bdbee9c7bec7ec7230c951183da0c794587dfa40493fb15e97fa5a",
    "ref": "seed"
  },
  "task": {
    "ref": "task/prompt.md",
    "sha256": "c33b8f3315a8cbd6de02ac8f938f948105a71a452e818487b3f9ece8b3dd65cf"
  },
  "expected_obligation_oracle": {
    "id": "f2_expected_stack",
    "implementation_sha256": "009e8e19b71d641847296436d8a49bb84b1c2d5ef74cdae0f254dc3a441e7c25"
  },
  "semantic_oracles": [
    {
      "id": "f2_project_semantics",
      "implementation_sha256": "3adf349bb87e0a9d9f34ccf6f5813678a20d031820e36047c61dd2783c1ec281",
      "kind": "task",
      "blocking": true
    }
  ],
  "protected_semantic_inputs": [],
  "truthful_gaps": {
    "expected_gap_ids": [],
    "extra_gap_policy": "reported_allowed",
    "precision_weight": 0.0,
    "recall_weight": 1.0
  },
  "protected_paths": [
    "fixture.json",
    "implementations.json",
    "expected_stack.json",
    "oracle.py",
    "controls.json",
    "controls/*",
    "task/*"
  ],
  "allowed_mutation_paths": [
    "Project/App/src/*"
  ],
  "safety_validators": [],
  "dimension_weights": {
    "semantic_outcome": 40,
    "safety_obligations": 30,
    "gate_reconciliation": 15,
    "stack_delivery": 10,
    "truthful_gaps": 5
  },
  "hard_gates": [],
  "fixture_hash": "d8385f64fad257380830e3606a18727b8fc1d8c5e61d2d3debb540d9dd7f1655"
}
